titulo,descripcion,fechaInicio,fechaFin,participantes
Worry Tough Father,Dark decide bill PM. Agreement red reason. Stage between country later one month growth.,2009-02-07,2015-08-15,2404
Stock Address System,Apply fast but gas section thus cost.,2017-03-05,2012-06-08,4138
Bank Everybody Respond,Color direction interesting head. Page relationship enough market success.,2003-03-29,2010-07-24,4032
Number Commercial Toward,Figure brother range follow. Pm wrong everything leg order candidate.,2013-03-06,2017-07-09,3955
While Woman Wall,Everybody explain care fact watch work. Side manage among.,2011-02-25,2006-02-02,490
Ahead Again Hold,Project shake commercial between oil wear believe. Middle call chair lay into enter.,2000-11-06,2015-08-19,4276
Cause Region Dog,Write these mouth any director series.,2016-11-14,2017-06-11,3619
Almost Paper Race,Effort would skin view positive outside move. Amount son operation situation point investment who.,2021-04-29,2018-06-14,338
Company Effect Poor,Ground statement which class this. Region world reflect quickly form.,2002-05-15,2015-12-07,3847
Push Feel Ten,Animal region career another someone hour night. Not PM make trouble method at.,2016-01-09,2012-01-28,3853
Sing Miss Yourself,Game very admit say never late dog. Do game hair beat political area admit.,2022-04-14,2008-04-24,1592
Growth Tax Way,Several process statement lay song. Citizen appear person energy say voice.,2009-07-27,2011-07-08,4009
Final Detail Result,Me develop where think marriage. Six case military couple whatever knowledge of.,2000-03-26,2011-04-29,1479
Third Food Change,Community hour news because. Production own himself use instead too.,2020-04-15,2002-12-12,4074
Strong Indicate Hot,American several individual notice upon program. Entire assume Democrat run if although heart.,2000-08-09,2017-11-23,2754
Until Increase Pass,Argue role whatever poor. Control send sit onto article imagine.,2021-01-27,2023-07-09,4918
Front Culture Experience,If recognize him then. Health institution bar rate.,2003-03-04,2019-12-24,1074
Wide Purpose Indeed,Who trouble us feeling.,2020-10-25,2020-10-27,3066
Western Investment Break,Treat ball husband present me high plan. Wide law sound each.,2011-03-21,2005-09-27,2690
Old Money Pretty,Response mother state. Safe none visit.,2014-02-03,2020-09-23,1140
Very Yes Some,Current method tough successful level. Kind relate within provide economy.,2022-01-04,2021-07-01,3344
Figure Tell Step,Art change begin himself agency environment. Lose week series why meet decade. News kind firm also.,2016-12-14,2002-08-20,3117
Color Without Simply,Join police character high. Month future nothing final provide.,2005-07-06,2014-03-10,1528
Real Gun Perhaps,Very light from guy. Ask Democrat lawyer. Dark news serious feel.,2004-02-21,2006-05-31,4043
Trouble Catch Task,Author political factor nice team adult board among. Seat and art under response ahead better.,2014-05-09,2020-01-01,3974
Foot Boy Record,"Third size situation.
Anyone only put glass age risk.",2017-11-02,2024-03-26,3519
Risk Second Government,Network produce dog until production. Worker about wide fire big. Rest shake card front who.,2002-02-03,2023-08-20,1325
Doctor Your War,Benefit staff send. Carry off four investment fill.,2000-07-02,2000-02-12,1760
Chance Likely One,Owner American information less baby water. Art pattern forward everybody method teacher quality.,2002-07-20,2006-12-29,4348
Effect Summer Thing,Result new view drug trade speech my material.,2002-08-07,2004-11-18,1814
Interesting Bag Purpose,Citizen young training be practice rise west focus. Already cost manager reveal first face.,2017-07-11,2008-05-16,4104
Project Recent Large,"Her develop three national.
How value visit can. Those daughter experience skill pass.",2023-08-03,2012-02-16,936
Conference Responsibility Somebody,"Too offer camera paper without.
Today wind wait. Side standard someone second long open result.",2000-05-24,2000-08-21,4697
Increase Member Instead,We do product bill involve. Radio authority everyone beautiful policy.,2005-09-11,2024-02-16,2481
Up Early Citizen,Yourself move treatment company. People option ask director.,2012-03-14,2009-01-27,480
Soldier Baby Most,Travel your resource. Challenge you behavior color crime speak marriage.,2009-07-27,2016-07-09,330
According Capital Effect,Economic education personal raise phone. Back spring social grow candidate.,2018-06-13,2018-08-09,1203
Red Position Although,Performance practice number note. Move reveal truth identify buy.,2011-03-16,2011-06-25,4513
Democrat Pm Special,Power identify machine put. While economy occur.,2023-06-11,2007-06-11,2080
Special Expect Tax,Garden my forget among view foot. Soon claim note impact. Brother before any.,2004-11-15,2012-06-25,3913
