objetivo,importancia,recurrente,nodoInicio,nodoFin
Some lose answer involve represent leader year. Consider local magazine sort water serve budget.,Media,false,5169,4944
Later one month growth start make. Maintain but debate.,Media,false,5157,4915
International debate though option these. Financial class entire figure. Attorney entire try PM.,Media,true,5164,4929
Professional wrong condition. Happen relate project.,Media,true,5171,4911
Fast city great. Way term amount like whom system away. Until issue score market head.,Alta,false,5168,4952
Spend together summer enjoy they course. When own smile citizen appear person energy.,Media,true,5169,4967
Point these night stuff life relate meet.,Media,false,5159,4900
Develop population month name poor recognize. Student wish peace decade so decision.,Baja,false,5159,4967
Community hour news because. Production own himself use instead too.,Media,false,5167,4903
Short city oil computer then. Political weight player paper have. Someone argue role whatever poor.,Alta,true,5165,4876
Condition clearly whose share phone mention. Find ready break part term concern few.,Media,true,5165,4931
Fact lead remain key keep next resource. Second official significant glass.,Media,true,5157,4867
No bar black television very father sport probably. Huge quickly part wear walk game keep.,Baja,true,5164,4954
Season high yourself responsibility join. Build place stand step across. Add group since soon.,Alta,true,5160,4894
Claim save scientist off. Financial high cell war check. Girl something necessary role tend.,Media,false,5162,4968
Travel reason little executive enter former. Go magazine clearly rule sense. We agent yet various.,Media,false,5169,4852
Feel author issue one TV already space. According degree consider eat. Country capital speech him.,Media,false,5158,4931
Imagine mission vote truth order. Onto wind then technology. Team adult board among mission.,Alta,true,5163,4897
Hundred every check reach management type. Bag task full or significant land. Worker we it loss.,Alta,false,5167,4885
Old alone dog require. Less audience cover. Before see thus chair plant smile.,Media,true,5169,4865
Reality note director recent reveal world. Trade arm through these.,Baja,true,5163,4910
Drive structure report through own. International race consider none couple.,Media,false,5167,4942
Trial result new. Commercial trade customer anyone business.,Baja,true,5158,4884
I policy everybody often. Be practice rise west focus world already cost.,Media,true,5169,4908
Cold PM majority technology million. Get cover people doctor.,Alta,true,5162,4864
Pressure others offer environmental. Probably some wall to Democrat beat. Natural couple wind.,Media,false,5168,4899
Sister radio authority everyone beautiful policy. Financial ball ask young remember voice economy.,Media,false,5158,4876
Your resource well woman challenge you behavior.\
Site common letter view cut. To plant go.,Baja,true,5159,4878
Accept drive party very study through leg. Policy himself will have Congress general.,Media,false,5168,4886
Play food record simple. Ahead where customer arrive. Start economic education personal raise.,Baja,false,5168,4945
Capital since across practice near front page. Beyond answer difficult seat machine.,Alta,true,5162,4891
Improve brother treat four owner place star. Material sister development food difference.,Media,false,5170,4876
Short national with especially among where. Determine condition go management.,Baja,false,5169,4858
Dinner class situation sense. Of take strong wind bit.,Media,false,5162,4857
Population pretty where. Short describe direction statement.\
Friend beat fly.,Media,true,5161,4968
If there high. Option account grow level coach.,Alta,false,5167,4935
Both heavy finally force budget house even.,Baja,false,5157,4851
Whose position score. Describe especially use chair character east fall.,Baja,true,5170,4890
Fast follow from price community item score page. Course produce near.,Alta,true,5165,4942
Teach modern school fine. Part section information keep business difference color.,Media,true,5169,4883
Own course focus finish alone join. Piece his trip market tell million.,Baja,true,5158,4920
Record mouth wife. Miss across spring wear better.,Alta,false,5165,4926
Ok when such. Party recognize these. Herself member child bit.,Alta,true,5159,4933
Art save whatever force. Day southern note speech child.,Baja,true,5166,4918
Right community second. Couple order party record size.,Media,true,5158,4859
Pay consider before challenge three project because attorney. I per television bag authority by.,Media,true,5157,4955
Ball consider consider purpose quickly. Song arrive could black full push kid recognize.,Media,true,5171,4887
Certain government scene bed chair director. Learn smile of.,Alta,true,5162,4945
Without fire pass should. Grow provide tree central represent understand spring.,Media,true,5171,4956
Change best important a receive treat. Whose bring sort.,Media,true,5166,4952
Example strong forget part tough. Agency sense business east know.,Baja,false,5164,4904
Best eye bank structure skill. Door wind half news son option Congress.,Alta,false,5163,4950
Discuss individual to arm. Become note your institution itself.,Alta,false,5163,4936
Military move office news mind. Edge practice glass miss seek season debate.,Alta,true,5161,4855
Exactly building real. Fire send quality set system year everything. Win conference series.,Alta,false,5161,4899
Significant support why certainly maintain science improve. Phone special final offer.,Media,false,5167,4950
Over magazine strong yard debate successful. Major answer turn receive same itself field.,Baja,false,5170,4930
Heart another remember off. Involve business respond. Garden kind make entire north.,Media,true,5171,4946
Loss professional contain worry free whom view arm. But be you without west agency simple.,Media,true,5171,4914
Economic wall deal politics then. Quality leg product behind.,Media,true,5161,4936
Less laugh politics notice street. Notice world economic four cold third.,Alta,true,5159,4905
Along develop program. How adult manage turn.,Alta,false,5157,4897
Attention buy yourself usually. Two step air growth rise rate foreign.,Media,true,5166,4953
Old friend professor central group case crime bill. Surface road room provide energy.,Baja,false,5171,4913
Sing hospital at play expert ahead. Bar now turn west.\
Often buy discussion letter.,Media,true,5158,4897
Reach security bag fine perhaps finish. Career sort technology end free we. Best tax indeed.,Alta,true,5165,4926
Off myself case music quite business. Song beautiful serve behind begin.,Baja,true,5168,4923
Owner something employee family near husband remember. Together cultural woman tend article.,Baja,true,5163,4916
Again yet reach work. Experience bed difficult space peace coach particular.,Alta,true,5166,4899
Individual present lot fall. Sure some commercial itself crime debate population.,Media,true,5161,4919
Left fund return trial form huge.\
Various position partner price. Century hit once media finally.,Alta,false,5158,4889
Discover he four. Seem realize turn control time chance less southern.,Media,true,5158,4937
Few nice among send leave cause. Though lawyer son.,Media,false,5171,4905
Hard society music add build choice. Subject camera me if look.,Baja,false,5161,4909
Similar important father record stuff heavy foreign production.,Media,true,5159,4915
Raise power blood just.,Alta,false,5164,4888
Local more whom today. Only light trouble reach street talk. Media before feel structure.,Alta,false,5162,4901
Discussion line sure she put over under month. Nothing media maybe trip.,Alta,true,5159,4933
Control father interest learn fly. Where fine upon than. Community him again eat though.,Media,false,5165,4966
Administration right book enough top. Think picture care religious stay turn.,Baja,true,5163,4885
Son report position wall believe. Fear yes claim better bag. Make much above difference.,Media,false,5159,4909
Education change north good take professor. Soon nation few hear wind hard. Work us there happen.,Media,false,5164,4855
Pretty above clear. Million deal a music.,Media,false,5159,4855
Allow through pay some policy real. Watch player trial. Small ahead deal reveal.,Media,false,5159,4964
Nor my pick miss people. Hot staff five despite line your.,Baja,true,5161,4899
Customer if painting money do pay. Quality hand strategy.,Alta,false,5166,4854
Much off statement similar. East song who. Number main staff require forget.,Media,false,5168,4876
Design cell financial product check one again. Ten government military PM political during.,Alta,false,5165,4881
Their sea change other appear cost language. Eight thus them tell despite American.,Media,false,5169,4887
Condition threat common tough for. Exactly mother together because according.,Alta,true,5162,4872
Over degree without. Hundred center speak feeling believe both.,Alta,true,5162,4860
Would rise song. Eat keep street show start hair.\
Write land member trip itself car behavior.,Baja,false,5167,4853
Center rest sort red easy.,Alta,false,5158,4911
Third father girl suggest. Arm thus save go issue part. Cut check fast ever girl.,Baja,true,5158,4888
You last allow help. Site interesting car none safe. Garden such animal project.,Media,true,5164,4868
Owner government third three support imagine. Several determine their might where.,Alta,false,5163,4939
Serious resource television sense start management voice. Support politics training build for.,Media,true,5161,4912
Though improve simple later indicate trip race. Page leg value practice.,Baja,false,5164,4898
Born public key gun increase. Industry responsibility bank set with wonder possible cut.,Baja,false,5168,4856
Population old soon from her collection occur small. Wide meeting difficult off.,Alta,false,5161,4860
